{
  "$schema": "../schema/agent-config.schema.json",
  "id": "senior-frontend-developer",
  "displayName": "Senior Frontend Developer",
  "role": "Project-agnostic frontend implementation across routes, components, state, forms, validation, accessibility, and responsiveness as scoped by the orchestrator.",
  "provider": "openai-codex",
  "model": "gpt-5.6-terra",
  "thinking": "medium",
  "tools": null,
  "sessionDir": ".pi/sessions/agents",
  "requiredFor": ["frontend implementation", "UI component work", "form work", "accessibility implementation"],
  "handoffInputs": ["orchestrator task packet", "active project instructions", "architecture plan", "UX guidance", "applicable contracts"],
  "handoffOutputs": ["frontend implementation", "component tests", "accessibility notes", "screenshot artifacts"]
}
