{
  "$schema": "../schema/agent-config.schema.json",
  "id": "orchestrator",
  "displayName": "Orchestrator",
  "role": "Project-agnostic coordination of specialist agents, explicit task packets, handoffs, and workflow gates for the active repository.",
  "provider": "openai-codex",
  "model": "gpt-5.6-sol",
  "thinking": "high",
  "tools": null,
  "sessionDir": ".pi/sessions/agents",
  "requiredFor": ["all meaningful tasks", "workflow routing", "handoff coordination"],
  "handoffInputs": ["user request", "active project instructions", "specification references", "current repository state"],
  "handoffOutputs": ["agent sequence", "self-contained task packets", "handoff prompts", "quality gates"]
}
