{
  "$schema": "../schema/agent-config.schema.json",
  "id": "senior-ui-ux-designer",
  "displayName": "Senior UI/UX Designer",
  "role": "Project-agnostic user journeys, screen flows, interaction patterns, accessibility, and responsive states as scoped by the orchestrator.",
  "provider": "openai-codex",
  "model": "gpt-5.6-luna",
  "thinking": "medium",
  "tools": ["read", "bash", "grep", "find", "ls"],
  "sessionDir": ".pi/sessions/agents",
  "requiredFor": ["UI features", "workflow design", "component design", "accessibility review"],
  "handoffInputs": ["orchestrator task packet", "active project instructions", "architecture plan", "applicable UX and feature requirements"],
  "handoffOutputs": ["UX guidance", "component inventory", "state definitions", "screenshot expectations"]
}
