{
  "$schema": "../schema/agent-config.schema.json",
  "id": "senior-backend-developer",
  "displayName": "Senior Backend Developer",
  "role": "Project-agnostic backend implementation across services, APIs, data, security, authorization, isolation, integrations, and operations as scoped by the orchestrator.",
  "provider": "openai-codex",
  "model": "gpt-5.6-terra",
  "thinking": "high",
  "tools": null,
  "sessionDir": ".pi/sessions/agents",
  "requiredFor": ["backend implementation", "API work", "database work", "security work", "integration work"],
  "handoffInputs": ["orchestrator task packet", "active project instructions", "architecture plan", "applicable contracts", "security requirements", "test strategy"],
  "handoffOutputs": ["backend implementation", "backend tests", "security notes", "tenant isolation notes"]
}
